{"worker_profile_id":"worker-profile-demo","schema_version":"1.0.0","profile_version":"1.0.0","profile_sha256":"cccccccccccccccccccccccccccccccccccccccccccccccccccccccccccccccc","display_name":"local-worker","execution_kind":"llm","provider_capability_ref":{"provider_id":"provider-demo","provider_kind":"gateway","capability_id":"capability-demo"},"model_policy":{"allowed_model_ids":["model-demo"],"default_model_id":"model-demo"},"allowed_steps":["0","1","1b","1c","2","3","3b","4a","4b"],"tool_policy":{"tool_policy_id":"tool-policy-demo","policy_version":"1.0.0","policy_sha256":"dddddddddddddddddddddddddddddddddddddddddddddddddddddddddddddddd","allowed_operations":["read_context","write_candidate_output","request_gateway_operation"],"direct_provider_calls_allowed":false},"enabled":true,"created_at":"2026-08-20T00:00:00Z"}
